{
  "schemaVersion": "1.0",
  "reviewRunId": "sample-run-0001",
  "requestRevision": 2,
  "readiness": "NeedsInformation",
  "summary": "Needs information. 1 blocking, 0 warning finding(s). Rule-only review of revision 2: 1 item(s) need attention.",
  "findings": [
    { "code": "MISSING_FIELD", "field": "manager", "severity": "Blocking", "message": "Line manager is required.", "ruleId": "A-REQ-MGR", "ruleVersion": 1, "sourceReference": "SAMPLE-POLICY-ALPHA-01 s2.3" }
  ],
  "mappingAssessment": { "status": "Matched", "mappingId": "A-MAP-ENG-DEV", "mappingVersion": 1, "explanation": "Matches published mapping A-MAP-ENG-DEV v1." },
  "clarificationQuestions": ["Please provide the line manager. (Required by A-REQ-MGR v1.)"],
  "humanReviewRequired": true,
  "limitations": ["This is an automated readiness check. It does not approve or grant access."]
}
